{
  "$schema": "./config.schema.json",

  "project_id": "<Configure your project ID and cookies in config.json>",

  "interval": 10,

  "base_url": "https://websim.com",

  "model_id": "gpt-5-mini",

  "additional_note": "",

  "cookie": "sb-hello-auth-token.1=114514; sb-hello-auth-token.0=base64-ABCDEF1919810",

  "auto_response_prefix": "[AUTOMATIC RESPONSE] ",

  "auto_response_create_revision": "Revision Created."
}
